{
  "productId": "S6_YM_1031LRKCT",
  "productName": "裕明单灯控制器",
  "properties": [
    {
      "id": "onOff",
      "name": "灯状态",
      "accessMode": "ro",
      "required": true,
      "type": "integer",
      "specs": {
        "optional": [
          {
            "value": 1,
            "desc": "在线"
          },
          {
            "value": 0,
            "desc": "离线"
          }
        ]
      }
    },
    {
      "id": "rs485Addr",
      "name": "rs485地址",
      "accessMode": "ro",
      "required": true,
      "type": "string"
    },
    {
      "id": "rs485Port",
      "name": "rs485端口",
      "accessMode": "ro",
      "required": true,
      "type": "integer",
      "specs": {
        "min": 1,
        "max": 8,
        "step": 1
      }
    },
    {
      "id": "rs485Baund",
      "name": "波特率",
      "accessMode": "ro",
      "required": true,
      "type": "integer",
      "specs": {
        "min": 1200,
        "max": 19200,
        "step": 1200
      }
    },
    {
      "id": "rs485DataBit",
      "name": "数据位",
      "accessMode": "ro",
      "required": true,
      "type": "integer",
      "specs": {
        "optional": [
          {
            "value": 6,
            "desc": "6数据位"
          },
          {
            "value": 7,
            "desc": "7数据位"
          },
          {
            "value": 8,
            "desc": "8数据位"
          }
        ]
      }
    },
    {
      "id": "rs485Parity",
      "name": "校验位",
      "accessMode": "ro",
      "required": true,
      "type": "string",
      "specs": {
        "optional": [
          {
            "value": "N",
            "desc": "无校验"
          },
          {
            "value": "E",
            "desc": "偶校验"
          },
          {
            "value": "O",
            "desc": "奇校验"
          }
        ]
      }
    },
    {
      "id": "rs485StopBit",
      "name": "停止位",
      "accessMode": "ro",
      "required": true,
      "type": "integer",
      "specs": {
        "optional": [
          {
            "value": 1,
            "desc": "1停止位"
          },
          {
            "value": 2,
            "desc": "2停止位"
          }
        ]
      }
    },
    {
      "id": "mode",
      "name": "控制模式",
      "accessMode": "ro",
      "required": true,
      "type": "string",
      "specs": {
        "optional": [
          {
            "value": "auto",
            "desc": "自动"
          },
          {
            "value": "manual",
            "desc": "手动"
          }
        ]
      }
    },
    {
      "id": "sn",
      "name": "设备sn",
      "accessMode": "ro",
      "required": true,
      "type": "string",
      "specs": {}
    },
    {
      "id": "model",
      "name": "设备model",
      "accessMode": "ro",
      "required": true,
      "type": "string",
      "specs": {}
    },
    {
      "id": "online",
      "name": "离线在线",
      "accessMode": "ro",
      "required": true,
      "type": "integer",
      "specs": {
        "optional": [
          {
            "value": 0,
            "desc": "离线"
          },
          {
            "value": 1,
            "desc": "在线"
          }
        ]
      }
    },
    {
      "id": "brightness",
      "name": "灯亮度",
      "accessMode": "ro",
      "required": true,
      "type": "integer",
      "specs": {
        "min": 0,
        "max": 100,
        "unit": "%",
        "unitName": "百分值",
        "step": 1
      }
    },
    {
      "id": "voltage",
      "name": "电压",
      "accessMode": "ro",
      "required": true,
      "type": "integer",
      "specs": {
        "unit": "mv",
        "unitName": "毫伏"
      }
    },
    {
      "id": "laekageCurrent",
      "name": "漏电流值",
      "accessMode": "ro",
      "required": true,
      "type": "integer",
      "specs": {
        "unit": "mA",
        "unitName": "漏电安培"
      }
    },
    {
      "id": "totalEnergy",
      "name": "总电能",
      "accessMode": "ro",
      "required": true,
      "type": "integer",
      "specs": {
        "unit": "Wh",
        "unitName": "瓦时"
      }
    },
    {
      "id": "versionNumber",
      "name": "灯控软件版本号",
      "accessMode": "ro",
      "required": true,
      "type": "string",
      "specs": {}
    },
    {
      "id": "current",
      "name": "电流",
      "accessMode": "ro",
      "required": true,
      "type": "integer",
      "specs": {
        "unit": "mA",
        "unitName": "毫安"
      }
    },
    {
      "id": "activePower",
      "name": "功率",
      "accessMode": "ro",
      "required": true,
      "type": "integer",
      "specs": {
        "unit": "W",
        "unitName": "瓦特"
      }
    }
  ],
  "events": [],
  "services": [
    {
      "id": "setOnOff",
      "name": "设置开关",
      "parameters": [
        {
          "id": "onOff",
          "name": "开关",
          "accessMode": "ro",
          "required": true,
          "type": "integer",
          "specs": {
            "optional": [
              {
                "value": 1,
                "desc": "开"
              },
              {
                "value": 0,
                "desc": "关"
              }
            ]
          }
        }
      ],
      "output": []
    },
    {
      "id": "setBrightness",
      "name": "设置亮度",
      "parameters": [
        {
          "id": "brightness",
          "name": "亮度",
          "accessMode": "ro",
          "required": true,
          "type": "integer",
          "specs": {
            "min": 0,
            "max": 100,
            "unit": "%",
            "unitName": "百分比",
            "step": 1
          }
        }
      ],
      "output": []
    },
    {
      "id": "switchMode",
      "name": "切换控制模式",
      "parameters": [
        {
          "id": "mode",
          "name": "控制模式",
          "required": true,
          "type": "string",
          "specs": {
            "optional": [
              {
                "value": "auto",
                "desc": "自动"
              },
              {
                "value": "manual",
                "desc": "手动"
              }
            ]
          }
        }
      ]
    }
  ]
}