{
  "productId": "S8_HK_DSPEA22F",
  "productName": "一键报警",
  "properties": [
    {
      "id": "sn",
      "name": "序列号",
      "accessMode": "ro",
      "required": true,
      "type": "string"
    },
    {
      "id": "ip",
      "name": "IP地址",
      "accessMode": "ro",
      "required": true,
      "type": "string"
    },
    {
      "id": "httpPort",
      "name": "Http端口",
      "accessMode": "ro",
      "required": true,
      "type": "integer"
    },
    {
      "id": "onvifUser",
      "name": "Onvif用户名",
      "accessMode": "ro",
      "required": true,
      "type": "string"
    },
    {
      "id": "onvifPassword",
      "name": "Onvif密码",
      "accessMode": "ro",
      "required": true,
      "type": "string"
    },
    {
      "id": "online",
      "name": "设备在线/离线状态",
      "accessMode": "ro",
      "required": true,
      "type": "integer",
      "specs": {
        "optional": [
          {
            "value": 1,
            "desc": "在线"
          },
          {
            "value": 0,
            "desc": "离线"
          }
        ]
      }
    },
    {
      "id": "mode",
      "name": "控制模式",
      "accessMode": "ro",
      "required": true,
      "type": "string",
      "specs": {
        "optional": [
          {
            "value": "auto",
            "desc": "自动"
          },
          {
            "value": "manual",
            "desc": "手动"
          }
        ]
      }
    },
    {
      "id": "manufacturer",
      "name": "厂商",
      "accessMode": "ro",
      "required": true,
      "type": "string"
    },
    {
      "id": "model",
      "name": "型号",
      "accessMode": "ro",
      "required": true,
      "type": "string"
    },
    {
      "id": "alarmList",
      "name": "告警事件",
      "accessMode": "ro",
      "required": true,
      "type": "array",
      "columnComplex": [
        {
          "id": "type",
          "name": "告警类型",
          "type": "string",
          "specs": {
            "optional": [
              {
                "value": "alarmIn",
                "desc": "一键报警"
              }
            ]
          }
        },
        {
          "id": "enable",
          "name": "是否订阅",
          "type": "integer",
          "specs": {
            "optional": [
              {
                "value": 1,
                "desc": "告警已订阅"
              },
              {
                "value": 0,
                "desc": "告警未订阅"
              }
            ]
          }
        }
      ]
    }
  ],
  "events": [
    {
      "id": "alarmIn",
      "name": "一键报警",
      "parameters": [
        {
          "id": "type",
          "name": "一键报警onvif告警类型",
          "type": "string",
          "specs": {
            "optional": [
              {
                "value": "alarmIn",
                "desc": "一键报警"
              }
            ]
          }
        },
        {
          "id": "process",
          "name": "告警开始/结束",
          "type": "integer",
          "specs": {
            "optional": [
              {
                "value": 1,
                "desc": "告警开始"
              },
              {
                "value": 0,
                "desc": "告警结束"
              }
            ]
          }
        }
      ]
    }
  ],
  "services": [
    {
      "id": "switchMode",
      "name": "切换手动/自动模式",
      "type": "management",
      "parameters": [
        {
          "id": "mode",
          "name": "模式",
          "type": "string",
          "required": true,
          "specs": {
            "optional": [
              {
                "value": "manual",
                "desc": "手动"
              },
              {
                "value": "auto",
                "desc": "自动"
              }
            ]
          }
        }
      ],
      "output": []
    }
  ]
}