{
  "productId": "ZCT245RD-LBQ-E2-77",
  "productName": "直川倾斜传感器",
  "properties": [
    {
      "id": "xAngle",
      "name": "X轴倾斜角度",
      "accessMode": "ro",
      "required": true,
      "type": "number",
      "specs": {
        "min": -45,
        "max": 45,
        "unit": "°",
        "unitName": "度",
        "step": 1
      }
    },
    {
      "id": "yAngle",
      "name": "Y轴倾斜角度",
      "accessMode": "ro",
      "required": true,
      "type": "number",
      "specs": {
        "min": -45,
        "max": 45,
        "unit": "°",
        "unitName": "度",
        "step": 1
      }
    },
    {
      "id": "xAngleThreshold",
      "name": "X轴倾斜阈值",
      "accessMode": "ro",
      "required": true,
      "type": "number",
      "specs": {
        "min": -45,
        "max": 45,
        "unit": "°",
        "unitName": "度",
        "step": 1
      }
    },
    {
      "id": "yAngleThreshold",
      "name": "Y轴倾斜阈值",
      "accessMode": "ro",
      "required": true,
      "type": "number",
      "specs": {
        "min": -45,
        "max": 45,
        "unit": "°",
        "unitName": "度",
        "step": 1
      }
    },
    {
      "id": "rs485Port",
      "name": "485端口",
      "accessMode": "rw",
      "required": true,
      "type": "integer",
      "specs": {
        "min": 1,
        "max": 8
      }
    },
    {
      "id": "rs485Addr",
      "name": "设备地址",
      "accessMode": "rw",
      "required": true,
      "type": "integer",
      "specs": {
        "min": 0,
        "max": 255
      }
    },
    {
      "id": "rs485Baund",
      "name": "波特率",
      "accessMode": "rw",
      "required": true,
      "type": "integer",
      "specs": {
        "min": 1200,
        "max": 19200
      }
    },
    {
      "id": "rs485DataBit",
      "name": "数据位",
      "accessMode": "rw",
      "required": true,
      "type": "integer",
      "specs": {
        "optional": [
          {
            "value": 6,
            "desc": "6数据位"
          },
          {
            "value": 7,
            "desc": "7数据位"
          },
          {
            "value": 8,
            "desc": "8数据位"
          }
        ]
      }
    },
    {
      "id": "rs485Parity",
      "name": "校验位",
      "accessMode": "rw",
      "required": true,
      "type": "string",
      "specs": {
        "optional": [
          {
            "value": "N",
            "desc": "无校验"
          },
          {
            "value": "E",
            "desc": "偶校验"
          },
          {
            "value": "O",
            "desc": "奇校验"
          }
        ]
      }
    },
    {
      "id": "rs485StopBit",
      "name": "停止位",
      "accessMode": "rw",
      "required": true,
      "type": "integer",
      "specs": {
        "optional": [
          {
            "value": 1,
            "desc": "1停止位"
          },
          {
            "value": 2,
            "desc": "2停止位"
          }
        ]
      }
    },
    {
      "id": "online",
      "name": "在线状态",
      "accessMode": "rw",
      "required": false,
      "type": "integer",
      "specs": {
        "optional": [
          {
            "value": 0,
            "desc": "离线"
          },
          {
            "value": 1,
            "desc": "在线"
          }
        ]
      }
    },
    {
      "id": "sn",
      "name": "设备sn",
      "accessMode": "ro",
      "required": true,
      "type": "string",
      "specs": {}
    }
  ],
  "events": [
    {
      "id": "xAlarmStart",
      "name": "x轴倾斜告警开始",
      "parameters": []
    },
    {
      "id": "xAlarmStop",
      "name": "x轴倾斜告警结束",
      "parameters": []
    },
    {
      "id": "yAlarmStart",
      "name": "y轴倾斜告警开始",
      "parameters": []
    },
    {
      "id": "yAlarmStop",
      "name": "y轴倾斜告警结束",
      "parameters": []
    }
  ],
  "services": [
    {
      "id": "setZeroMode",
      "name": "设置零点模式",
      "type": "business",
      "parameters": [
        {
          "id": "zeroMode",
          "name": "零点模式",
          "accessMode": "ro",
          "required": true,
          "type": "integer",
          "specs": {
            "optional": [
              {
                "value": 0,
                "desc": "绝对模式"
              },
              {
                "value": 1,
                "desc": "零点模式"
              }
            ]
          }
        }
      ],
      "output": []
    },
    {
      "id": "setXAlarmAngle",
      "name": "设置x轴倾斜阈值",
      "type": "business",
      "parameters": [
        {
          "id": "xAlarmAngle",
          "name": "x轴倾斜阈值",
          "accessMode": "ro",
          "required": true,
          "type": "number",
          "specs": {
            "min": -45,
            "max": 45,
            "unit": "°",
            "unitName": "度",
            "step": 1
          }
        }
      ],
      "output": []
    },
    {
      "id": "setYAlarmAngle",
      "name": "设置y轴倾斜阈值",
      "type": "business",
      "parameters": [
        {
          "id": "yAlarmAngle",
          "name": "y轴倾斜阈值",
          "accessMode": "ro",
          "required": true,
          "type": "number",
          "specs": {
            "min": -45,
            "max": 45,
            "unit": "°",
            "unitName": "度",
            "step": 1
          }
        }
      ],
      "output": []
    },
    {
      "id": "setXAlarmFrequency",
      "name": "设置X轴告警重复上报频率",
      "type": "business",
      "parameters": [
        {
          "id": "frequency",
          "name": "X轴告警频率",
          "accessMode": "ro",
          "required": true,
          "type": "integer",
          "specs": {
            "min": 1,
            "max": 86400,
            "unit": "s",
            "unitName": "秒",
            "step": 1
          }
        }
      ],
      "output": []
    },
    {
      "id": "setYAlarmFrequency",
      "name": "设置y轴告警重复上报频率",
      "type": "business",
      "parameters": [
        {
          "id": "frequency",
          "name": "Y轴告警频率",
          "accessMode": "ro",
          "required": true,
          "type": "integer",
          "specs": {
            "min": 1,
            "max": 86400,
            "unit": "s",
            "unitName": "秒",
            "step": 1
          }
        }
      ],
      "output": []
    },
    {
      "id": "switchMode",
      "name": "切换模式",
      "type": "management",
      "parameters": [
        {
          "id": "mode",
          "name": "模式",
          "accessMode": "ro",
          "required": true,
          "type": "string",
          "specs": {
            "optional": [
              {
                "value": "manual",
                "desc": "手动"
              },
              {
                "value": "auto",
                "desc": "自动"
              }
            ]
          }
        }
      ],
      "output": []
    }
  ]
}