{
  "productId": " S3_DH_ITSXS170127RGAB",
  "productName": "大华交通屏",
  "properties": [{
      "id": "sn",
      "name": "设备sn号",
      "accessMode": "ro",
      "required": true,
      "type": "string"
    },
    {
      "id": "width",
      "name": "宽度",
      "accessMode": "ro",
      "required": true,
      "type": "integer",
      "specs": {
        "min": 64,
        "max": 4096,
        "unit": "px",
        "unitName": "像素",
        "step": 32
      }
    },
    {
      "id": "height",
      "name": "长度",
      "accessMode": "ro",
      "required": true,
      "type": "integer",
      "specs": {
        "min": 64,
        "max": 1536,
        "unit": "px",
        "unitName": "像素",
        "step": 32
      }
    },
    {
      "id": "ip",
      "name": "ip地址",
      "accessMode": "ro",
      "required": true,
      "type": "string"
    },
    {
      "id": "online",
      "name": "在线状态",
      "accessMode": "ro",
      "required": true,
      "type": "integer",
      "specs": {
        "optional": [{
            "value": 0,
            "desc": "离线"
          },
          {
            "value": 1,
            "desc": "在线"
          }
        ]
      }
    },
    {
      "id": "playStatus",
      "name": "播放状态",
      "accessMode": "ro",
      "required": true,
      "type": "integer",
      "specs": {
        "optional": [{
            "value": 0,
            "desc": "空闲"
          },
          {
            "value": 1,
            "desc": "在播"
          }
        ]
      }
    },
    {
      "id": "onOff",
      "name": "屏幕状态",
      "accessMode": "ro",
      "required": true,
      "type": "integer",
      "specs": {
        "optional": [{
            "value": 0,
            "desc": "关屏"
          },
          {
            "value": 1,
            "desc": "开屏"
          }
        ]
      }
    },
    {
      "id": "playingProgram",
      "name": "正在播放的节目",
      "accessMode": "ro",
      "required": true,
      "type": "string"
    },
    {
      "id": "brightness",
      "name": "亮度",
      "accessMode": "ro",
      "required": true,
      "type": "integer",
      "specs": {
        "min": 0,
        "max": 100,
        "step": 1
      }
    },
    {
      "id": "programList",
      "name": "节目列表",
      "accessMode": "ro",
      "required": true,
      "type": "array",
      "columnComplex": [{
        "id": "fileName",
        "name": "节目文件名",
        "type": "string"
      }, {
        "id": "md5",
        "name": "节目的md5",
        "type": "string"
      }]
    },
    {
      "id": "customizeProgramList",
      "name": "节目列表",
      "accessMode": "ro",
      "required": true,
      "type": "array",
      "columnComplex": [{
        "id": "fileName",
        "name": "节目文件名",
        "type": "string"
      }, {
        "id": "md5",
        "name": "节目的md5",
        "type": "string"
      }]
    },
    {
      "id": "mode",
      "name": "控制模式",
      "accessMode": "ro",
      "required": true,
      "type": "string",
      "specs": {
        "optional": [{
            "value": "auto",
            "desc": "自动"
          },
          {
            "value": "manual",
            "desc": "手动"
          }
        ]
      }
    }
  ],
  "events": [],
  "services": [{
      "id": "setOnOff",
      "name": "开关屏",
      "parameters": [{
        "id": "onOff",
        "name": "开关",
        "required": true,
        "type": "integer",
        "specs": {
          "optional": [{
              "value": 0,
              "desc": "关屏"
            },
            {
              "value": 1,
              "desc": "开屏"
            }
          ]
        }
      }]
    },
    {
      "id": "setBrightness",
      "name": "设置亮度",
      "parameters": [{
        "id": "brightness",
        "name": "亮度",
        "required": true,
        "type": "integer",
        "specs": {
          "min": 0,
          "max": 100,
          "step": 1
        }
      }]
    },
    {
      "id": "addProgram",
      "name": "添加节目",
      "parameters": [{
          "id": "url",
          "name": "节目url地址",
          "required": true,
          "type": "string"
        },
        {
          "id": "fileName",
          "name": "节目名",
          "required": true,
          "type": "string"
        },
        {
          "id": "md5Sum",
          "name": "文件MD5",
          "required": true,
          "type": "string"
        }
      ]
    },
    {
      "id": "delProgram",
      "name": "删除节目",
      "parameters": [{
        "id": "fileName",
        "name": "节目名",
        "required": true,
        "type": "string"
      }]
    },
    {
      "id": "renameProgram",
      "name": "更改节目名",
      "parameters": [{
          "id": "oldProgramName",
          "name": "改动前节目名字",
          "required": true,
          "type": "string"
        },
        {
          "id": "newProgramName",
          "name": "改动后节目名字",
          "required": true,
          "type": "string"
        }
      ]
    },
    {
      "id": "playProgram",
      "name": "播放节目",
      "parameters": [{
        "id": "fileName",
        "name": "节目名",
        "required": true,
        "type": "string"
      }]
    },

    {
      "id": "delCustomizeProgram",
      "name": "删除自定义节目模板",
      "parameters": [{
        "id": "fileName",
        "name": "节目名",
        "required": true,
        "type": "string"
      }]

    },
    {
      "id": "getProgramList",
      "name": "查询节目列表",
      "parameters": [],
      "output": [{
        "id": "programList",
        "name": "节目文件名和md5列表",
        "type": "array",
        "columnComplex": [{
          "id": "fileName",
          "name": "节目文件名",
          "type": "string"
        }, {
          "id": "md5",
          "name": "节目的md5",
          "type": "string"
        }]
      }]
    },
    {
      "id": "getCustomizeProgramList",
      "name": "查询自定义模板节目",
      "parameters": [],
      "output": [{
        "id": "customizeProgramList",
        "name": "模板文件名和md5列表",
        "type": "array",
        "columnComplex": [{
          "id": "fileName",
          "name": "节目文件名",
          "type": "string"
        }, {
          "id": "md5",
          "name": "节目的md5",
          "type": "string"
        }]
      }]
    },
    {
      "id": "addCustomizeProgram",
      "name": "添加自定义节目模板",
      "parameters": [{
          "id": "fileName",
          "name": "节目名",
          "required": true,
          "type": "string"
        },
        {
          "id": "url",
          "name": "模板文件的url地址",
          "required": true,
          "type": "string"
        },
        {
          "id": "md5Sum",
          "name": "模板文件的MD5",
          "required": true,
          "type": "string"
        }
      ]
    },
    {
      "id": "stopProgram",
      "name": "停止播放",
      "parameters": []
    },
    {
      "id": "switchMode",
      "name": "切换控制模式",
      "parameters": [{
        "id": "mode",
        "name": "控制模式",
        "required": true,
        "type": "string",
        "specs": {
          "optional": [{
              "value": "auto",
              "desc": "自动"
            },
            {
              "value": "manual",
              "desc": "手动"
            }
          ]
        }
      }]
    }
  ]
}